<?xml version="1.0" encoding="UTF-8"?>
<archive xmlns="http://rs.tdwg.org/dwc/text/"
	xmlns:xsi="http://www.w3.org/2001/XMLSchema-instance"
	xmlns:xs="http://www.w3.org/2001/XMLSchema"
	xsi:schemaLocation="http://rs.tdwg.org/dwc/text/ ../../text/tdwg_dwc_text.xsd"
	>
	
	<!-- Here is an example that will define the structure of 
		
		 institutionCode,collectionCode,recordedBy,CollectorNumber,count,date,
		 "Kew gardens, (Kew)",Plant Specimens,Tim Robertson,12,,12,20010101-12:12:01
		 "Kew gardens, (Kew)",Plant Specimens,Markus Döring,14,,,, 
	-->
	<core 
		rowType="http://rs.tdwg.org/dwc/terms/text/DarwinRecord"
		fieldsTerminatedBy=","
		linesTerminatedBy="\n"
		fieldsEnclosedBy="&quot;"
		compression="GZIP" 
		encoding="UTF-8"
		ignoreHeaderLines="1"
		dateFormat="YYYYMMDD-hh:mm:ss">
		<files>
			<location>http://data.gbif.org/download/occurrence-search-123255244678924570.zip</location>
		</files>
		<id index="0"/>
		<field index="2" 
			   term="http://rs.tdwg.org/dwc/terms/fieldNumber" 
			   type="xs:string" 
			   default="timrobertson100"/>
		<field index="3" 
			   term="http://rs.tdwg.org/dwc/terms/recordNumber" 
			   type="xs:integer"/>
		<field index="5" 
			   term="http://rs.tdwg.org/dwc/terms/individualCount" 
			   type="xs:integer" 
			   default="1"/>
		<!-- ¿ format is like this ? -->
		<field index="6" 
			   term="http://rs.tdwg.org/dwc/terms/eventDate" 
			   type="xs:dateTime"/>
		<!-- A constant value -->
		<field term="http://rs.tdwg.org/dwc/terms/datasetID"
			   type="xs:string"
			   default="urn:lsid:tim.lsid.tdwg.org:collections:1" />
	</core>
</archive>